{
  "id": "053",
  "date": "2025-11",
  "name": "GTIG report: just-in-time AI malware (PROMPTSTEAL, PROMPTFLUX)",
  "type": "threat-report",
  "lens": "weapon",
  "vector": "autonomous-ops",
  "channel_in": "none",
  "authority": "shell/exec",
  "channel_out": "code exec",
  "adversarial": true,
  "outcome": "data-exfiltration",
  "cve": [],
  "sources": [
    {
      "url": "https://cloud.google.com/blog/topics/threat-intelligence/threat-actor-usage-of-ai-tools",
      "title": "GTIG AI Threat Tracker: Advances in Threat Actor Usage of AI Tools",
      "publisher": "Google Cloud",
      "accessed": "2026-10-03"
    }
  ],
  "summary": "APT28 malware queried Qwen at runtime for commands; first LLM-in-malware seen in operations.",
  "mappings": {
    "owasp_agentic": [],
    "owasp_llm": [],
    "mitre_atlas": [
      "AML.T0016.002",
      "AML.T0102"
    ]
  },
  "affected": {
    "vendors": [
      "Google"
    ],
    "products": [
      "Gemini API",
      "Hugging Face Inference API"
    ],
    "frameworks": []
  },
  "tags": [
    "threat-report",
    "llm-in-malware",
    "just-in-time-malware"
  ],
  "status": "confirmed"
}
