{
  "id": "034",
  "date": "2025-07",
  "name": "Gemini CLI silent code execution via context file",
  "type": "vulnerability-disclosure",
  "lens": "surface",
  "vector": "indirect-injection",
  "channel_in": "document",
  "authority": "shell/exec",
  "channel_out": "code exec",
  "adversarial": true,
  "outcome": "code-execution",
  "cve": [],
  "sources": [
    {
      "url": "https://tracebit.com/blog/code-exec-deception-gemini-ai-cli-hijack"
    }
  ],
  "summary": "README injection abused grep allowlist; reported 27 June, fixed in v0.1.14 on 25 July.",
  "mappings": {
    "owasp_agentic": [
      "ASI01",
      "ASI05"
    ],
    "owasp_llm": [
      "LLM01",
      "LLM06"
    ],
    "mitre_atlas": [
      "AML.T0051.001",
      "AML.T0050"
    ]
  },
  "affected": {
    "vendors": [
      "Google"
    ],
    "products": [
      "Gemini CLI"
    ],
    "frameworks": []
  },
  "tags": [
    "coding-agent",
    "allowlist-bypass",
    "context-file"
  ],
  "status": "confirmed"
}
