{
  "id": "068",
  "date": "2026-03",
  "name": "Langflow CVE-2026-33017 exploited within 20 hours",
  "type": "incident",
  "lens": "target",
  "vector": "exploitation",
  "channel_in": "none",
  "authority": "shell/exec",
  "channel_out": "code exec",
  "adversarial": true,
  "outcome": "data-exfiltration",
  "cve": [
    "CVE-2026-33017"
  ],
  "sources": [
    {
      "url": "https://www.sysdig.com/blog/cve-2026-33017-how-attackers-compromised-langflow-ai-pipelines-in-20-hours"
    }
  ],
  "summary": "Public build endpoint RCE exploited 20 hours after advisory; attackers harvested keys and .env files.",
  "mappings": {
    "owasp_agentic": [],
    "owasp_llm": [],
    "mitre_atlas": [
      "AML.T0049",
      "AML.T0055"
    ]
  },
  "affected": {
    "vendors": [
      "Langflow"
    ],
    "products": [
      "Langflow"
    ],
    "frameworks": [
      "Langflow"
    ]
  },
  "tags": [
    "rce",
    "exposed-endpoint",
    "in-the-wild-exploitation"
  ],
  "status": "confirmed"
}
